#,Levels,Unnamed: 2,Unnamed: 3,Unnamed: 4,Unnamed: 5,Unnamed: 6,Unnamed: 7,Code,URL,Skill,Category,Subcategory,Overall description,Guidance notes,Level 1 description,Level 2 description,Level 3 description,Level 4 description,Level 5 description,Level 6 description,Level 7 description
18,,2.0,3.0,4.0,5.0,6,7.0,SCTY,https://sfia-online.org/en/skillcode/9/SCTY,Information security,Strategy and architecture,Security and privacy,Defining and operating a framework of security controls and security management strategies.,"Activities may include, but are not limited to:

selecting and adapting security frameworks to protect confidentiality, integrity, and availability of systems
implementing security controls, including physical, procedural, technical, and compliance measures
ensuring accountability and adherence to relevant laws and standards
embedding secure by design principles throughout the system's lifecycle, ensuring security is integrated from the earliest design stages, through development, deployment, and into operations
identifying and mitigating risks in infrastructure and applications.

Security controls include, but are not limited to:

physical controls - protecting tangible assets and physical environments
procedural or administrative controls - policies and guidelines governing organisational security practices
technical or logical controls - hardware and software measures that protect information systems
legal, regulatory or compliance controls - measures ensuring laws, regulations and industry standards.

These activities are typically performed in collaboration with specialists in other areas including, but not limited to: legal, technical infrastructure, audit, architecture and software engineering.",,"Assists with implementing and monitoring security policies and protocols across different systems.
Contributes to identifying and addressing potential risks in security governance and compliance.
Supports the analysis of documented security incidents, escalating where appropriate.
Assists in the review of access controls and permissions, ensuring adherence to security policies.","Applies and maintains specific security controls as required by organisational policy and local risk assessments.
Communicates security risks and issues to business managers and others. Performs basic risk assessments for small information systems. 
Contributes to the identification of risks that arise from potential technical solution architectures. Suggests alternate solutions or countermeasures to mitigate risks. Defines secure systems configurations in compliance with intended architectures.
Supports investigation of suspected attacks and security breaches.","Provides guidance on the application and operation of elementary physical, procedural and technical security controls. 
Explains the purpose of security controls and performs security risk and business impact analysis for medium complexity information systems. 
Identifies risks that arise from potential technical solution architectures. Designs alternate solutions or countermeasures and ensures they manage identified risks. 
Investigates suspected attacks and supports security incident management.","Provides advice and guidance on security strategies to manage identified risks and ensure adoption and adherence to standards. 
Contributes to development of information security policy, standards and guidelines. 
Obtains and acts on vulnerability information and conducts security risk assessments, business impact analysis and accreditation on complex information systems. Investigates major breaches of security and recommends appropriate control improvements. 
Develops new architectures that manage the risks posed by new technologies and business practices.","Develops and communicates corporate information security policy, standards and guidelines.  
Ensures architectural principles are applied during design to reduce risk. Drives adoption and adherence to policy, standards and guidelines. 
Contributes to the development of organisational strategies that address information control requirements. Identifies and monitors environmental and market trends and proactively assesses impact on business strategies, benefits and risks. 
Leads the provision of authoritative advice and guidance on the requirements for security controls in collaboration with subject matter experts.","Directs the development, implementation, delivery and support of an enterprise information security strategy aligned with the business strategy. 
Ensures compliance between business strategies and information security. 
Leads the provision of information security expertise, guidance and systems needed to execute strategic and operational plans.
Secures organisational resources to execute the information security strategy."
19,,2.0,3.0,4.0,5.0,6,7.0,INAS,https://sfia-online.org/en/skillcode/9/INAS,Information assurance,Strategy and architecture,Security and privacy,"Protecting against and managing risks related to the use, storage and transmission of data and information systems.","Activities include, but are not limited to:

management of risk in a pragmatic and cost-effective manner to ensure stakeholder confidence
formal system certification and accreditation
assessing the effectiveness of cryptographic controls
technical assessment and evaluation to determine control effectiveness.

Information and data are typically protected by following five principles:

availability - ensuring authorised users can easily access the information they need
integrity - protecting information from unauthorised modification, retrieval or deletion
authenticity - validating the identity of users and devices
confidentiality - restricting access to authorised users only
non-repudiation - preventing possible denial that an action occurred by ensuring data is true to its origin.
",,"Assists with information assurance activities under routine supervision.
Helps perform basic risk assessments and supports the implementation of information assurance measures.
Assists in maintaining records and documentation related to information assurance.","Follows standard approaches for the technical assessment of information systems against information assurance policies and business objectives. 
Makes routine accreditation decisions. Recognises decisions that are beyond their scope and responsibility level and escalates according.
Reviews and performs risk assessments and risk treatment plans. Identifies typical risk indicators and explains prevention measures.
Maintains integrity of records to support and justify decisions.","Performs technical assessments and/or accreditation of complex or higher-risk information systems. 
Identifies risk mitigation measures required in addition to the standard organisation or domain measures. 
Establishes the requirement for accreditation evidence from delivery partners and communicates accreditation requirements to stakeholders.  
Contributes to planning and organisation of information assurance and accreditation activities. Contributes to development of and implementation of information assurance processes.","Interprets information assurance and security policies and applies these to manage risks. 
Provides advice and guidance to ensure adoption of and adherence to information assurance architectures, strategies, policies, standards and guidelines. 
Plans, organises and conducts information assurance and accreditation of complex domains areas, cross-functional areas and across the supply chain. 
Contributes to the development of policies, standards and guidelines.","Develops information assurance policy, standards and guidelines. 
Contributes to the development of organisational strategies that address the evolving business risk and information control requirements. 
Drives adoption of and adherence to policies and standards. Ensures architectural principles are followed, requirements are defined and rigorous security testing is applied. Ensures accreditation processes support and enable organisational objectives.
Monitors environmental and market trends and assesses any impact on organisational strategies, benefits and risks.","Directs the creation and review of an enterprise information assurance strategy to support the strategic requirements of the business.
Ensures compliance between business strategies and information assurance by setting strategies, policies, standards and practices. 
Leads the provision of information assurance expertise, advice and guidance across all of the organisation's information and information systems."
20,,,,4.0,5.0,6,,PEDP,https://sfia-online.org/en/skillcode/9/PEDP,Information and data compliance,Strategy and architecture,Security and privacy,Implementing and promoting compliance with information and data management legislation.,"Includes legislation regulating the holding, use and disclosure of personal data.
Activities may include, but are not limited to:

providing expert advice on policies, procedures and governance
designing privacy-friendly products, services and systems that respect customer privacy and embed data protection
performing impact assessments, identify risks whilst enabling prudent use of data and addressing issues with products and services
responding to incidents
following legislative developments
creating risk models and frameworks
working with subject matter experts in areas such as, but not limited to, legal, public relations, learning and development, procurement, security, data management and architecture.
",,,,"Supports the implementation of policy, standards and guidelines related to information and data legislation and compliance requirements.
Monitors the implementation of effective controls for internal delegation, audit and control relating to information management.
Reports on the consolidated status of information controls to inform effective decision-making.
Identifies risks around the use of information  and data that is subject to specific legislation. Recommends remediation actions as required.","Contributes to policies, standards and guidelines for information and data compliance. 
Provides authoritative advice on implementing compliance controls in products, services and systems. 
Investigates breaches and recommends control improvements.  Maintains an inventory of legislated data, conducts risk assessments and specifies necessary changes. 
Ensures formal requests and complaints are handled following procedures. Prepares and submits reports to relevant authorities, ensuring all compliance requirements are met.","Develops strategies for compliance with information and data legislation. 
Ensures that the policy and standards for compliance with information and data legislation are fit for purpose, current and correctly implemented. 
Acts as the organisation's contact for the regulatory authorities. 
Operates as a focus for information and data legislation for the organisation, working with specialists to provide authoritative advice and guidance.",
