#,Levels,Unnamed: 2,Unnamed: 3,Unnamed: 4,Unnamed: 5,Unnamed: 6,Unnamed: 7,Code,URL,Skill,Category,Subcategory,Overall description,Guidance notes,Level 1 description,Level 2 description,Level 3 description,Level 4 description,Level 5 description,Level 6 description,Level 7 description
10,,,,4.0,5.0,6,,FMIT,https://sfia-online.org/en/skillcode/9/FMIT,Financial management,Strategy and architecture,Financial and value management,"Managing the effective use and control of financial resources to support business strategies, compliance and risk mitigation.","This skill typically applies to dedicated financial management roles, not to managers of operational or project budgets.
Financial management should align with business strategies and practices in areas such as governance, risk management, portfolio, programme and project management, and asset management.
Activities may include, but are not limited to:

managing financial control and stewardship of assets and resources
supporting strategic financial decision-making and business unit collaboration
aligning budgeting, forecasting and accounting practices with organisational goals
guiding financial management for consumption-based costs like cloud services
promoting financial practices to support iterative/agile working across the organisation
overseeing development of service, project and component cost models to meet strategic objectives
defining and overseeing charging models for service provision
ensuring compliance with accounting standards, policies and regulatory requirements
providing proactive risk management and mitigation strategies
monitoring business unit performance against financial targets and KPIs, offering insights and recommendations.
",,,,"Monitors and maintains financial records to ensure compliance and audit requirements are met.
Provides general support in financial planning and budgeting by compiling and reporting on financial data.
Supports decision-making by collating and summarising financial information at a high level.
Collaborates with business units to gather financial data and understand operational needs.","Provides general advice and guidance on financial planning, budgeting and accounting using recognised practices and standards.
Develops high-level financial plans and forecasts to guide organisational strategies and plans.
Monitors expenditure to ensure alignment with budgetary goals.
Contributes to financial control frameworks and supports strategic decision-making by summarising expenditure trends and variances.","Develops organisational policies, standards and guidelines for financial management to support strategic business goals.
Promotes financial governance and drives adherence to financial policies and standards. Collaborates with senior leaders and business unit heads to ensure financial strategies support overall business objectives.
Oversees the setting and management of financial budgets and targets at a strategic level.
Leads high-level reviews of financial performance and implements improvements to align budget usage with organisational priorities.",
11,,,,4.0,5.0,6,,INVA,https://sfia-online.org/en/skillcode/9/INVA,Investment appraisal,Strategy and architecture,Financial and value management,Assessing the attractiveness of possible investments or projects.,"Activities may include, but are not limited to:

selecting and using appropriate techniques to compare financial investments and returns
using recognised investment appraisal techniques to compare investment and returns include payback period, accounting rate of return, discounted cash flow (net present value and internal rate of return)
collecting data using appropriate top-down or bottom-up approaches
including other factors into the appraisal approach, such as legal considerations, environmental or social impact, operational benefits and risk
developing scoring methods to allow for subjective benefits or dis-benefits and to aggregate the results of multiple appraisal methods to help compare options
documenting and presenting the results of investment appraisals
establishing investment appraisal as a tool for selecting projects/initiatives for further investigation
identifying possible sources of funding and the impact on the investment appraisal.
",,,,"Develops and documents investment appraisals for a range of different projects. 
Identifies suitable appraisal techniques based on the characteristics of a project. 
Collects the information required to create an investment appraisal in collaboration with internal and external stakeholders. Presents findings of investment appraisals to selected stakeholders. 
Refines and maintains investment appraisals.","Advises on investment appraisal approaches and tailors organisational standards to the context of portfolios/programmes.  
Leads investment appraisal activities for simple portfolios and programmes and complex projects.","Develops organisational policies, standards and guidelines for investment appraisals. 
Leads activities to establish consistent appraisal across the component projects and programmes within a portfolio. 
Reviews investment appraisals for high-value initiatives to assure their quality. 
Leads investment appraisal activities for complex programmes of work and portfolios.",
12,,,3.0,4.0,5.0,6,,BENM,https://sfia-online.org/en/skillcode/9/BENM,Benefits management,Strategy and architecture,Financial and value management,"Forecasting, planning and monitoring the emergence and effective realisation of anticipated benefits from projects and programmes.","Activities may include, but are not limited to:

implementing a benefits management framework and approach
identifying and implementing the actions needed to optimise the business impact of individual and combined benefits
confirming the achievement of expected benefits
adapting benefits management practices for agile projects
using data-driven analysis for benefits identification, tracking and reporting
engaging stakeholders to embed a value-driven culture.

",,,"Supports the identification and tracking of benefits for projects and programmes.  
Collects data to measure benefits realisation.","Contributes to the development and implementation of benefits management plans for projects and programmes. 
Engages with stakeholders to identify and quantify benefits and to establish metrics and mechanisms for tracking benefits realisation. 
Monitors and reports on progress towards benefits realisation. 
Identifies risks and issues that may impact benefits delivery and escalates as appropriate. Supports the embedding of benefits management practices across the organisation.","Leads activities required in the realisation of the benefits of each part of the change programme. 
Identifies specific metrics and mechanisms to measure benefits and plans to activate these mechanisms at the required time. Monitors benefits against what was predicted in the business case. 
Ensures all participants are engaged throughout the change programme and fully prepared to exploit the new operational business environment. 
Supports operational managers to ensure all plans, work packages and deliverables are aligned with the expected benefits.","Works with operational managers to ensure maximum improvements are made as groups of projects deliver their products into operational use. 
Communicates the change programme vision to staff at all levels of the business and keeps a focus on business objectives. 
Maintains the business case for funding the programme and confirms continuing business viability of the programme at regular intervals.",
13,,2.0,3.0,4.0,5.0,6,,BUDF,https://sfia-online.org/en/skillcode/9/BUDF,Budgeting and forecasting,Strategy and architecture,Financial and value management,Developing and managing financial budgets and forecasts to enable effective decision-making and resource allocation.,"Activities may include, but are not limited to:

gathering and analysing financial data to prepare budgets and forecasts
selecting and applying appropriate budgeting and forecasting methodologies and tools
incorporating scenario planning, sensitivity analysis and risk assessment into the budgeting and forecasting process
presenting budget and forecast information to stakeholders and facilitating data-driven decision-making
developing and implementing budgeting and forecasting strategies, policies and processes aligned with organisational objectives
driving the adoption of good practices 
providing strategic insights and recommendations based on budget and forecast analysis
ensuring compliance with accounting standards, governance, legal and regulatory requirements
applying budgeting and forecasting to cloud computing and FinOps contexts, such as consumption-based pricing, rapid scalability, and the need for real-time cost-visibility and optimisation.
",,"Assists in gathering financial data and preparing basic budget templates under supervision. 
Supports the budgeting and forecasting process by completing assigned tasks.","Performs specified tasks in the budgeting and forecasting process, including data analysis and report preparation, using standard methods. 
Identifies and resolves routine budgeting and forecasting issues. 
Communicates budget and forecast information to relevant stakeholders.","Contributes to the development of budgets and forecasts for specific areas of responsibility.
Gathers and analyses financial data and prepares budget templates and reports.
Supports stakeholder communication and collaboration in the budgeting and forecasting process.","Leads the development of budgets and forecasts for a department or function.
Provides authoritative advice and guidance on budgeting and forecasting practices. Selects and applies appropriate budgeting and forecasting methodologies and tools.
Incorporates scenario planning, sensitivity analysis and risk assessment into the budgeting and forecasting process.
Collaborates with stakeholders to align budgets and forecasts with organisational objectives and business metrics.","Develops and implements budgeting and forecasting strategies, policies and processes aligned with overall organisational objectives and business metrics. 
Drives the adoption of good working practices across the organisation.
Oversees the development of complex financial models and scenario analyses to support strategic decision-making. Provides insights and recommendations to optimise investments and resource allocation.
Collaborates with senior leaders to ensure budgets and forecasts support long-term organisational goals and drive value creation. Sets the vision and direction for budgeting and forecasting practices.",
14,,2.0,3.0,4.0,5.0,6,,FIAN,https://sfia-online.org/en/skillcode/9/FIAN,Financial analysis,Strategy and architecture,Financial and value management,Conducting in-depth analysis of financial data to derive insights and support decision-making.,"Activities may include, but are not limited to:

preparing financial insights, dashboards and visualisations to support decision-making
developing and maintaining financial models for scenario planning and sensitivity analysis
providing authoritative advice on financial analysis practices and techniques
presenting findings to stakeholders
defining the organisation's approach to financial analysis, aligning it with objectives
implementing financial analysis policies, standards and processes
developing a culture of data-driven decision-making and continuous improvement
providing strategic insights based on comprehensive financial analysis
evaluating investments, projects and services using financial analysis techniques
applying financial analysis to cloud computing, such as consumption-based pricing and cost optimisation.
",,"Assists in collecting and organising financial data and preparing basic reports under supervision. 
Supports the financial analysis process by completing assigned tasks and seeking guidance when needed.","Applies established financial analysis techniques and processes to carry out specific tasks such as detailed data analysis, report generation and interpretation of financial metrics. 
Contributes to the development of actionable insights for decision-making.
Communicates financial analysis findings to relevant stakeholders.","Performs financial analysis for specific areas, using standard techniques and tools. 
Prepares reports and provides insights to support decision-making. Conducts cost-benefit analyses and supports stakeholder collaboration in the cost management process. 
Collaborates with stakeholders to understand requirements and deliver relevant analysis. 
Supports the development and maintenance of financial models.","Leads financial analysis activities for a department or function, applying advanced techniques and tools. Develops and maintains complex financial models.
Conducts scenario planning and sensitivity analysis to support decision-making. Provides authoritative advice and guidance on recommended financial analysis practices.
Presents findings and recommendations to senior stakeholders, linking financial performance to business outcomes. Collaborates with stakeholders to align analysis with organisational objectives.","Defines and leads the organisation's approach to financial analysis, aligning it with strategic objectives and business value creation.
Develops and implements enterprise-wide financial analysis policies, standards and processes. Drives a culture of data-driven decision-making and continuous improvement in financial management.
Provides strategic insights and recommendations based on comprehensive financial analysis, linking performance to business strategy.",
15,,2.0,3.0,4.0,5.0,6,,COMG,https://sfia-online.org/en/skillcode/9/COMG,Cost management,Strategy and architecture,Financial and value management,"Planning, controlling and analysing costs to enable the effective use of financial resources.","Activities may include, but are not limited to:

developing and implementing cost management strategies, policies and procedures
analysing costs, identifying trends, and recommending corrective actions
conducting cost-benefit analyses and supporting stakeholder collaboration in the cost management process
overseeing the development of complex cost models and reporting frameworks
presenting cost management insights to stakeholders and facilitating data-driven decision-making
promoting a culture of cost awareness and ongoing improvement throughout the organisation
implementing cost management processes and tools to support cloud computing and FinOps in areas such as consumption-based pricing, rapid scalability, and real-time cost visibility and optimisation.
",,"Assists in gathering cost data and preparing basic cost reports under supervision. 
Supports the cost management process by completing assigned tasks and seeking guidance when needed.","Applies standard cost management techniques and processes to monitor and report on costs within a specific area of responsibility.
Identifies and escalates cost variances and supports the implementation of cost-saving initiatives. Collaborates with stakeholders to gather cost data and provide reports.","Develops and implements cost management processes and procedures for a department or function.
Monitors actual performance against budget and identifies variances.
Analyses costs, identifies trends and recommends corrective actions.
Provides guidance and advice on cost management techniques and tools.","Leads the development and implementation of cost management strategies, policies and procedures for a significant area of the organisation.
Provides authoritative advice and guidance on cost optimisation techniques and recognised good practices. Oversees the development of complex cost models and reporting frameworks.
Presents cost management insights to senior stakeholders and facilitates data-driven decision-making. Promotes a culture of cost consciousness and continuous improvement.","Defines and leads the organisation's overall approach to cost management, aligning it with strategic objectives and financial goals.
Develops and implements enterprise-wide cost management policies, standards and processes. Collaborates with senior leaders to identify and drive cost optimisation initiatives.
Provides strategic insights and recommendations to optimise cost performance and drive long-term value creation. Sets the vision and direction for cost management across the organisation.",
16,,,,4.0,5.0,6,,DEMM,https://sfia-online.org/en/skillcode/9/DEMM,Demand management,Strategy and architecture,Financial and value management,Analysing and proactively managing business demand for new services or modifications to existing service features or volumes.,"Activities may include, but are not limited to:

collaborating with the business to prioritise demand to improve business value
developing and communicating insights into patterns of demand
performing what-if analyses and scenario planning to develop insights and proposals to improve business value
proposing responses to meet both short-term and long-term demand and facilitating decision-making and planning
integrating demand analysis and planning with complementary strategic, operational and change planning processes.
",,,,"Performs demand management analysis and planning activities within a specific business or operational area. 
Monitors patterns of demand and identifies insights and proposals to improve business value. 
Identifies and assesses opportunities to prioritise or improve alignment between business demand and capacity to deliver. 
Engages stakeholders to communicate insights, plans and decisions regarding business demand.","Implements demand management analysis and  planning activities. 
Provides advice to help stakeholders adopt and adhere to the agreed demand management approach. Manages the process of integrating demand management  with complementary strategic, operational and change management processes. 
Maintains a register of business requests and routes requests to the right place. Reports on the status of each request.
Reviews new business proposals and provides advice on demand issues. Works with business representatives to agree and implement short-term and medium-term modifications to demand.","Defines the approach and sets policies for discovering, analysing, planning, controlling and documenting demand for services and products. 
Organises scoping and business priority setting for strategic business changes involving business policymakers and direction setters. 
Engages with and influences senior stakeholders to improve the business value delivered from new or existing services and products. 
Leads the development of demand management capabilities. Leads the integration of demand management with complementary strategic, operational and change management processes.",
17,,2.0,3.0,4.0,5.0,6,,MEAS,https://sfia-online.org/en/skillcode/9/MEAS,Measurement,Strategy and architecture,Financial and value management,Developing and operating a measurement capability to support agreed organisational information needs.,"Measurement can be applied to organisations, projects, processes and work products.
Activities may include, but are not limited to:

planning, implementation and control of activities to measure attributes of processes, products and services
using measures to assess performance and progress and provide indications and insights to actual or potential problems, issues and risks
identifying requirements for measurement
implementing measurement to support iterative/agile working practices
selecting measures and measurement scales, setting target values and thresholds
establishing data collection and analysis methods, including automation
real-time and near-real-time measurement.

The measurement skill has diverse applications across industries, including customer experience, IT systems and services, marketing, supply chain, software development, finance, healthcare and project management.",,"Assists in the collection and maintenance of data for measurement purposes under routine supervision.
Uses standard procedures for measuring attributes of processes, products and services. 
Helps generate and distribute measurement reports.","Applies standard techniques to support the specification of measures and the collection and maintenance of data for measurement. 
Generates, produces and distributes reports. 
Uses measurement tools for routine analysis of data. 
Identifies and implements improvements to data collection methods.","Identifies and prioritises appropriate measures, scales and targets. 
Supports projects, functions or teams in the development of measurement methods. 
Specifies base and derived measures which support agreed information needs. Specifies how to collect and store the data for each required measure. Provides guidance on collection of data. 
Designs reports and reporting formats.","Establishes measurement objectives and the scope of measurement for functions, teams and projects. 
Plans and implements improvements to measurement capability. Provides advice and guidance for effective use of measures and measurement.  
Selects measures appropriate to the context and organisational objectives. Reviews data collection and storage mechanisms to support measurement.
Contributes to organisational policies, standards and guidelines for measurement.","Leads the development of organisational capabilities for measurement (including automation). 
Creates the measurement framework and aligns measurement objectives with business objectives. 
Develops organisational policies, standards and guidelines for measurement. 
Provides resources to ensure adoption and adherence to policies and standards.",
